{
  "lane_id": "lane-L6",
  "item_id": "level:6",
  "result": {
    "level": 6,
    "verdict": "pass",
    "counts": {
      "active_total": 10,
      "approved": 10,
      "pending": 0,
      "domain_vocabulary": 4,
      "domain_grammar": 3,
      "domain_reading": 3,
      "errors": 0,
      "warnings": 0,
      "min_total": 9,
      "min_per_domain": 3
    },
    "quality": {
      "error_rate": 0.0,
      "warning_rate": 0.0
    },
    "defects": [],
    "hard_fail": false
  },
  "confidence": 0.95,
  "evidence": [
    "level=6",
    "active_total=10",
    "by_domain={'vocabulary': 4, 'grammar': 3, 'reading': 3}",
    "by_status={'approved': 10}"
  ],
  "unresolved": []
}
